{
  "$schema": "http://json-schema.org/draft-07/schema#",
  "$id": "https://honua.io/schemas/sample.v1.schema.json",
  "title": "Honua Sample Manifest v1",
  "description": "Schema for samples/<sample-id>/sample.json. Every runnable sample in this repo declares itself with one of these manifests; CI validates it on every PR (see scripts/validate-manifests.mjs).",
  "type": "object",
  "additionalProperties": false,
  "required": [
    "id",
    "title",
    "description",
    "contentKind",
    "learning",
    "dataMode",
    "auth",
    "capabilities",
    "sdks",
    "protocols",
    "entrypoint",
    "status"
  ],
  "properties": {
    "id": {
      "type": "string",
      "description": "Kebab-case identifier. MUST match the name of the containing samples/<sample-id>/ directory.",
      "pattern": "^[a-z0-9]+(-[a-z0-9]+)*$"
    },
    "title": {
      "type": "string",
      "description": "Short human-readable title shown in the gallery.",
      "minLength": 1
    },
    "description": {
      "type": "string",
      "description": "One or two sentences describing what the sample demonstrates.",
      "minLength": 1
    },
    "contentKind": {
      "type": "string",
      "description": "Learning-content contract. Examples isolate one concept, walkthroughs guide a multi-step task, and projects are production-shaped applications whose complete repository source is the primary artifact.",
      "enum": ["example", "walkthrough", "project"]
    },
    "learning": {
      "type": "object",
      "description": "Expectations a developer can evaluate before opening the sample.",
      "additionalProperties": false,
      "required": ["goal", "level", "estimatedMinutes", "prerequisites"],
      "properties": {
        "goal": {
          "type": "string",
          "description": "One primary developer outcome per sample.",
          "enum": ["connect-data", "build-map", "query-data", "analyze-data", "operate-realtime", "explore-imagery-3d", "migrate-app", "automate-workflow"]
        },
        "level": {
          "type": "string",
          "enum": ["beginner", "intermediate", "advanced"]
        },
        "estimatedMinutes": {
          "type": "number",
          "minimum": 1,
          "maximum": 120
        },
        "prerequisites": {
          "type": "array",
          "description": "Concrete requirements visible before launch. Empty means no prerequisites.",
          "items": { "type": "string", "minLength": 1 },
          "uniqueItems": true
        }
      }
    },
    "dataMode": {
      "type": "string",
      "description": "Where the default run gets its data.",
      "enum": ["public-live", "local-integration", "fixture"]
    },
    "auth": {
      "type": "string",
      "description": "Authentication required by the default run.",
      "enum": ["anonymous", "admin-api-key", "none"]
    },
    "capabilities": {
      "type": "array",
      "description": "Dot-namespaced capability keys this sample exercises, e.g. 'serve.feature-service'. Every key must appear in the canonical capability key list (see schemas/fixtures/capability-keys.fixture.json and the KEY_LIST_URL indirection in .github/workflows/validate.yml).",
      "items": {
        "type": "string",
        "pattern": "^[a-z0-9]+(-[a-z0-9]+)*\\.[a-z0-9]+(-[a-z0-9]+)*$"
      },
      "minItems": 1,
      "uniqueItems": true
    },
    "sdks": {
      "type": "array",
      "description": "Which SDK(s)/client style the sample uses. 'rest' means raw HTTP with no SDK package.",
      "items": {
        "type": "string",
        "enum": ["js", "python", "dotnet", "rest"]
      },
      "minItems": 1,
      "uniqueItems": true
    },
    "protocols": {
      "type": "array",
      "description": "Wire protocols the sample talks, e.g. 'geoservices-rest', 'ogc-api-features'.",
      "items": {
        "type": "string",
        "minLength": 1
      },
      "minItems": 1,
      "uniqueItems": true
    },
    "edition": {
      "type": "string",
      "description": "Minimum Honua Server edition required to run this sample. Defaults to 'community' when omitted.",
      "enum": ["community", "pro", "enterprise"],
      "default": "community"
    },
    "entrypoint": {
      "type": "object",
      "description": "How the headless runner (scripts/run-samples.mjs) executes this sample.",
      "additionalProperties": false,
      "required": ["type", "command"],
      "properties": {
        "type": {
          "type": "string",
          "description": "Runtime family used to run 'command'. 'browser' runs headless via Playwright instead of a child process -- see 'command' below.",
          "enum": ["node", "python", "dotnet", "script", "browser"]
        },
        "command": {
          "type": "string",
          "description": "For type 'node' | 'python' | 'dotnet' | 'script': a shell command run with the sample directory as the working directory. For type 'browser': the path (relative to the sample directory) of the sample's static HTML page -- e.g. 'src/index.html'. The runner does not navigate to it directly: every browser sample MUST ship Playwright specs at samples/<id>/verify/*.spec.mjs, which serve and drive the page against the composed server, and those specs are the sample's only pass/fail signal (a browser sample with no verify spec fails). Pages conventionally still set a `data-sample-status` attribute (`pass` or `fail`) on `<body>` for their specs to assert on. See 'Browser lane' in README.md and docs/browser-verification/README.md.",
          "minLength": 1
        },
        "build": {
          "type": "object",
          "description": "Only for type 'browser': the sample is a built app (package.json + package-lock.json at the sample root, e.g. a Vite app). The gallery runs 'command' in a clean export of the committed sample directory and publishes 'outputDir' instead of committed static files (see scripts/lib/own-sample-apps.mjs). Cross-field rules (type 'browser' only, paths stay inside the sample) are enforced by scripts/validate-manifests.mjs.",
          "additionalProperties": false,
          "required": ["command", "outputDir", "publishedEntrypoint"],
          "properties": {
            "command": {
              "type": "string",
              "description": "Shell command run with the exported sample directory as the working directory, e.g. 'npm ci && npm run build'.",
              "minLength": 1
            },
            "outputDir": {
              "type": "string",
              "description": "Build output directory, relative to the sample directory, e.g. 'dist'. Every file in it is published; it must not contain symlinks.",
              "minLength": 1
            },
            "publishedEntrypoint": {
              "type": "string",
              "description": "The HTML page the gallery serves, relative to 'outputDir', e.g. 'index.html'.",
              "minLength": 1
            }
          }
        }
      }
    },
    "status": {
      "type": "string",
      "description": "'active' samples are executed by the headless runner in CI/nightly. 'draft' samples are validated but not yet executed.",
      "enum": ["active", "draft"]
    }
  }
}
