{
  "id": "hello-featureserver-rest",
  "title": "Query a public FeatureServer (plain REST)",
  "description": "Discovers the first layer in the public Maui buildings service and queries three real features with plain fetch().",
  "contentKind": "example",
  "learning": {
    "goal": "connect-data",
    "level": "beginner",
    "estimatedMinutes": 7,
    "prerequisites": ["Node.js 20+", "Internet access"]
  },
  "dataMode": "public-live",
  "auth": "anonymous",
  "capabilities": [
    "serve.geoservices-featureserver"
  ],
  "sdks": [
    "rest"
  ],
  "protocols": [
    "geoservices-rest"
  ],
  "edition": "community",
  "entrypoint": {
    "type": "node",
    "command": "node src/run.mjs"
  },
  "status": "active"
}
