{
  "id": "odata-query-rest",
  "title": "Read spatial features with OData v4",
  "description": "Discovers a public layer and reads three spatial features plus the server-side count with plain fetch().",
  "contentKind": "example",
  "learning": {
    "goal": "query-data",
    "level": "beginner",
    "estimatedMinutes": 8,
    "prerequisites": ["Node.js 20+", "Internet access"]
  },
  "dataMode": "public-live",
  "auth": "anonymous",
  "capabilities": [
    "serve.odata"
  ],
  "sdks": [
    "rest"
  ],
  "protocols": [
    "odata"
  ],
  "edition": "community",
  "entrypoint": {
    "type": "node",
    "command": "node src/run.mjs"
  },
  "status": "active"
}
