{
  "id": "wms-getmap-check",
  "title": "WMS GetCapabilities + GetMap check (Node.js)",
  "description": "Zero-dependency Node.js walkthrough of classic WMS: imports a tiny GeoJSON dataset, publishes it, requests GetCapabilities and GetMap, and asserts a real, correctly-sized PNG comes back -- not just a 200 status.",
  "contentKind": "walkthrough",
  "learning": {
    "goal": "build-map",
    "level": "advanced",
    "estimatedMinutes": 8,
    "prerequisites": [
      "Local Honua Server",
      "Node.js 22+"
    ]
  },
  "dataMode": "local-integration",
  "auth": "admin-api-key",
  "capabilities": [
    "import.file",
    "serve.wms"
  ],
  "sdks": [
    "rest"
  ],
  "protocols": [
    "wms"
  ],
  "edition": "community",
  "entrypoint": {
    "type": "node",
    "command": "node src/run.mjs"
  },
  "status": "active"
}
