{
    "id":  "browser-featureserver-query",
    "title":  "Query three FeatureServer features from a browser page",
    "description":  "A static HTML page reads a FeatureServer service description, queries its first layer for three features with plain fetch() (no SDK), and prints them as JSON. It defaults to the public demo maui-buildings service; the baseUrl, service and where query parameters point it elsewhere.",
    "contentKind":  "example",
    "learning":  {
                     "goal":  "query-data",
                     "level":  "intermediate",
                     "estimatedMinutes":  8,
                     "prerequisites":  [
                                           "Modern web browser",
                                           "Internet access"
                                       ]
                 },
    "dataMode":  "public-live",
    "auth":  "anonymous",
    "capabilities":  [
                         "import.file",
                         "serve.geoservices-featureserver"
                     ],
    "sdks":  [
                 "rest"
             ],
    "protocols":  [
                      "geoservices-rest"
                  ],
    "edition":  "community",
    "entrypoint":  {
                       "type":  "browser",
                       "command":  "src/index.html"
                   },
    "status":  "active"
}
